{"pairId":"PAIR-HEAT","judgeSlot":"SOL-ULTRA","order":"REFERENCE_FIRST","replicate":1,"criteria":[{"criterion":"camera","label":"RELATED","confidence":"HIGH","similar":["Both use an elevated oblique city-map view with visible structure sides.","Both frame the playable network across most of the viewport."],"different":["REFERENCE is closer and more terrain-relief-driven; CANDIDATE is broader and shallower.","Ground axes and landmark framing differ materially, with more isolated upright sprites in CANDIDATE."],"evidence":[{"imageRole":"REFERENCE","roi":"MAP","box":[60,90,830,920],"observation":"Close oblique framing emphasizes ravines, large plants, and a dense city edge."},{"imageRole":"CANDIDATE","roi":"MAP","box":[60,85,800,920],"observation":"Wider, flatter overview exposes longer routes and more separated interactive structures."}],"criticalFailure":false},{"criterion":"density","label":"RELATED","confidence":"HIGH","similar":["Both maps combine dense housing, roads, pylons, and industrial districts.","Both concentrate urban mass toward the right and industrial mass toward the left."],"different":["REFERENCE has stronger foreground massing and large industrial anchors.","CANDIDATE leaves broader open corridors between active assets despite a dense background."],"evidence":[{"imageRole":"REFERENCE","roi":"MAP","box":[470,300,1000,1000],"observation":"Residential blocks densely fill the right half around the selected substation."},{"imageRole":"REFERENCE","roi":"LANDMARK","box":[40,105,290,855],"observation":"Two large industrial complexes strongly occupy the left side."},{"imageRole":"CANDIDATE","roi":"MAP","box":[300,250,1000,1000],"observation":"Background buildings are numerous, but active facilities remain widely separated by open road and terrain areas."}],"criticalFailure":false},{"criterion":"river","label":"RELATED","confidence":"HIGH","similar":["Both show a dark winding channel cutting through dry brown terrain.","Both channels have rocky banks and network crossings nearby."],"different":["REFERENCE presents a deeper, darker ravine-like channel; CANDIDATE water is flatter and more uniformly brown.","CANDIDATE has two conspicuous attached bridges, while REFERENCE crossings are dominated by pylons and conductors."],"evidence":[{"imageRole":"REFERENCE","roi":"RIVER","box":[0,300,540,1000],"observation":"A sinuous recessed channel runs from the central map toward the lower-left edge."},{"imageRole":"CANDIDATE","roi":"RIVER","box":[80,80,430,690],"observation":"A shallower winding channel is crossed by two large illuminated bridges."}],"criticalFailure":false},{"criterion":"scale","label":"RELATED","confidence":"MEDIUM","similar":["Plants remain the largest silhouettes and pylons remain smaller repeated units.","Substations and civic facilities occupy an intermediate visual tier in both."],"different":["REFERENCE uses larger plant masses as dominant regional landmarks.","CANDIDATE foreground buildings and facilities approach pylon or transformer scale more unevenly."],"evidence":[{"imageRole":"REFERENCE","roi":"LANDMARK","box":[45,105,255,350],"observation":"The upper-left generating plant is substantially larger than nearby towers and houses."},{"imageRole":"REFERENCE","roi":"LANDMARK","box":[120,520,300,855],"observation":"A second broad industrial complex anchors the lower-left region."},{"imageRole":"CANDIDATE","roi":"LANDMARK","box":[380,600,705,870],"observation":"Large isolated building sprites, small substations, and pylons share a less graduated scale range."}],"criticalFailure":false},{"criterion":"material","label":"CLOSE","confidence":"HIGH","similar":["Both use blackened riveted metal, brown soil and concrete, amber windows, and cyan accents.","Both maintain a cohesive weathered industrial finish across map and overlays."],"different":["REFERENCE has richer cracked-ground relief and stronger metallic highlights.","CANDIDATE midtones are more uniformly sepia and several map sprites appear flatter or greyer."],"evidence":[{"imageRole":"REFERENCE","roi":"MAP","box":[0,85,830,1000],"observation":"Detailed cracked soil, dark masonry, metal machinery, and amber pin lighting remain distinct."},{"imageRole":"CANDIDATE","roi":"MAP","box":[0,82,820,1000],"observation":"The same brown-black-amber material family is present with a flatter overall wash."},{"imageRole":"CANDIDATE","roi":"HUD","box":[0,0,1000,82],"observation":"Riveted black-metal framing closely matches the map's industrial material language."}],"criticalFailure":false},{"criterion":"grid","label":"RELATED","confidence":"HIGH","similar":["Both use cyan routes linking pylons, substations, and facilities.","Both distinguish a troubled or planned segment with a warm contrasting color."],"different":["REFERENCE conductors glow strongly and read as direct tower-to-tower energy paths.","CANDIDATE routes are thinner schematic double lines, with overlaps and less precise visible attachment."],"evidence":[{"imageRole":"REFERENCE","roi":"GRID","box":[125,165,800,865],"observation":"Bright cyan conductors and node glows clearly trace the energized path through successive towers."},{"imageRole":"REFERENCE","roi":"GRID","box":[430,710,540,835],"observation":"A short amber-orange segment visibly identifies the stressed connection."},{"imageRole":"CANDIDATE","roi":"GRID","box":[55,80,760,860],"observation":"Thin cyan polylines cover the map, while the lower-right route changes to a dashed pink-red segment."}],"criticalFailure":false},{"criterion":"hud","label":"CLOSE","confidence":"HIGH","similar":["Both use a riveted chrome top bar, a left vertical build kit, and a right inspector.","Panel proportions and edge placement leave a similarly large integrated map area."],"different":["CANDIDATE uses denser, smaller text in the inspector and top status blocks.","REFERENCE gives the selected object portrait and capacity state stronger visual prominence."],"evidence":[{"imageRole":"REFERENCE","roi":"HUD","box":[0,0,1000,85],"observation":"Segmented black-metal status modules span the top edge."},{"imageRole":"CANDIDATE","roi":"HUD","box":[0,0,1000,82],"observation":"A closely matched segmented riveted status bar spans the same edge."},{"imageRole":"REFERENCE","roi":"HUD","box":[835,95,995,560],"observation":"Large portrait, capacity line, unavailable state, and condition form a clear inspector hierarchy."}




  ],"criticalFailure":false},{"criterion":"state","label":"CLOSE","confidence":"HIGH","similar":["Both visibly identify a +8°C heat event.","Both apply an amber-brown atmosphere, bright sun, and drought-like terrain to the same grid-world type."],"different":["REFERENCE has stronger sun bloom and more explicit cracked, scorched ground.","CANDIDATE relies more on a uniform brown tint and status text for the heat read."],"evidence":[{"imageRole":"REFERENCE","roi":"STATE-CONTEXT","box":[85,0,250,85],"observation":"The top status visibly reads HEAT +8°C."},{"imageRole":"REFERENCE","roi":"STATE-CONTEXT","box":[675,0,855,225],"observation":"A bright low sun and intense amber haze dominate the upper-right world."},{"imageRole":"CANDIDATE","roi":"STATE-CONTEXT","box":[440,0,710,85],"observation":"The top event module visibly includes 폭염 +8°C."}




  ],"criticalFailure":false},{"criterion":"timeline","label":"PARITY","confidence":"HIGH","similar":["Both use a centered four-cell bottom strip with black riveted chrome.","Both have nearly identical normalized footprint and an active second cell outlined in cyan.","CANDIDATE visibly includes progress, current event, result, and next-stage states."],"different":["CANDIDATE uses denser stage text and small status markers, a minor hierarchy variation."],"evidence":[{"imageRole":"REFERENCE","roi":"TIMELINE","box":[284,920,628,1000],"observation":"Four evenly sized bottom controls sit in a compact integrated metal tray with the second highlighted."},{"imageRole":"CANDIDATE","roi":"TIMELINE","box":[285,927,623,1000],"observation":"Four event-stage cells occupy the same centered footprint, with construction progress, an active event, result, and next labels."}],"criticalFailure":false}]}