{"pairId":"PAIR-NORMAL","judgeSlot":"SOL-ULTRA","order":"REFERENCE_FIRST","replicate":1,"criteria":[{"criterion":"camera","label":"CLOSE","confidence":"HIGH","similar":["Both use an elevated isometric projection with matching diagonal ground axes.","Both frame industrial territory left and residential territory right."],"different":["The CANDIDATE is slightly more top-down and wider, making world objects appear smaller.","The REFERENCE concentrates the focal network nearer the center."],"evidence":[{"imageRole":"REFERENCE","roi":"MAP","box":[60,85,835,996],"observation":"Elevated isometric world view with diagonal roads and broad left-to-right utility framing."},{"imageRole":"CANDIDATE","roi":"MAP","box":[94,81,818,929],"observation":"Closely matched isometric axes, with a somewhat higher and wider world framing."}],"criticalFailure":false},{"criterion":"density","label":"RELATED","confidence":"HIGH","similar":["Both maps contain industrial clusters, residential masses, roads, and utility corridors.","Occupied zones extend across most of each frame."],"different":["The REFERENCE has denser continuous micro-detail and more organic mass distribution.","The CANDIDATE leaves broader tiled corridors and uses more repetitive residential blocks."],"evidence":[{"imageRole":"REFERENCE","roi":"MAP","box":[90,101,831,990],"observation":"Dense rubble, roads, facilities, and housing create near-continuous map texture."},{"imageRole":"CANDIDATE","roi":"MAP","box":[94,83,823,926],"observation":"Large building clusters are present, but open grid plots and repeated blocks remain conspicuous."}],"criticalFailure":false},{"criterion":"river","label":"RELATED","confidence":"HIGH","similar":["Both show a narrow winding dark-blue channel through industrial terrain.","Both use recessed rocky banks and subdued water reflections."],"different":["The channel curvature and screen placement differ materially.","The CANDIDATE makes bridge decks and bank edges much more prominent than the REFERENCE."],"evidence":[{"imageRole":"REFERENCE","roi":"RIVER","box":[0,319,389,1000],"observation":"Organic narrow channel winds through rubble with comparatively quiet crossings."},{"imageRole":"CANDIDATE","roi":"RIVER","box":[0,255,495,657],"observation":"Central winding channel has sharply defined banks and conspicuous raised bridge geometry."}],"criticalFailure":false},{"criterion":"scale","label":"RELATED","confidence":"MEDIUM","similar":["Plants, pylons, substations, and housing share broadly comparable role-based sizing.","Utility towers remain readable above surrounding buildings in both."],"different":["CANDIDATE housing is smaller and more repetitive relative to pylons.","CANDIDATE bridge and industrial silhouettes occupy different proportions from the REFERENCE landmarks."],"evidence":[{"imageRole":"REFERENCE","roi":"LANDMARK","box":[30,122,257,309],"observation":"Large plant, towers, and ancillary structures form a cohesive relative scale."},{"imageRole":"REFERENCE","roi":"LANDMARK","box":[670,469,763,618],"observation":"Residential substation is prominent but remains proportionate to nearby homes."},{"imageRole":"CANDIDATE","roi":"LANDMARK","box":[115,537,245,787],"observation":"Industrial plant and pylons dominate more strongly over nearby small buildings."}],"criticalFailure":false},{"criterion":"material","label":"CLOSE","confidence":"HIGH","similar":["Both use blackened metal, soot-dark soil, worn concrete, and restrained amber windows.","Muted blue water and cyan electrical accents sit within the same low-midtoned palette."],"different":["The CANDIDATE ground reads more uniformly tiled and crushed-black.","The REFERENCE has richer localized metal and rubble highlights."],"evidence":[{"imageRole":"REFERENCE","roi":"MAP","box":[96,85,825,958],"observation":"Cohesive layered metal, concrete, rubble, soil, and amber illumination."},{"imageRole":"CANDIDATE","roi":"MAP","box":[91,79,823,907],"observation":"Very similar dark industrial material family with flatter tiled ground passages."}],"criticalFailure":false},{"criterion":"grid","label":"CLOSE","confidence":"HIGH","similar":["Both distinguish energized cyan conductors from planned amber dashed routes.","Both routes follow sequences of color-matched pylons and remain readable across the map."],"different":["The CANDIDATE conductors are thinner and less luminous.","Several CANDIDATE route turns appear looser at tower attachments."],"evidence":[{"imageRole":"REFERENCE","roi":"GRID","box":[120,96,748,602],"observation":"Bright multi-strand cyan conductors visibly connect the upper and right substations."},{"imageRole":"REFERENCE","roi":"GRID","box":[200,357,610,873],"observation":"Amber dotted construction route tracks clearly through amber pylons."},{"imageRole":"CANDIDATE","roi":"GRID","box":[143,74,693,602],"observation":"Cyan multi-line route and pale towers clearly indicate energized infrastructure."}],"criticalFailure":false},{"criterion":"hud","label":"CLOSE","confidence":"HIGH","similar":["Both use riveted black industrial chrome across top status, left kit, and right inspector panels.","Overlay proportions and cyan/amber hierarchy integrate similarly with the map."],"different":["The CANDIDATE inspector has more unused dark space and smaller secondary text.","The CANDIDATE top status bar is more segmented and visually busier."],"evidence":[{"imageRole":"REFERENCE","roi":"HUD","box":[0,0,1000,86],"observation":"Compact riveted top bar presents resources, power, date, and pause state."},{"imageRole":"REFERENCE","roi":"HUD","box":[831,101,998,469],"observation":"Right inspector uses a compact image, capacity, meter, and action hierarchy."},{"imageRole":"CANDIDATE","roi":"HUD","box":[0,0,1000,83],"observation":"Closely matched riveted top chrome with cyan and amber status bands."}],"criticalFailure":false},{"criterion":"timeline","label":"PARITY","confidence":"HIGH","similar":["Both use a centered four-cell bottom strip with heavy industrial chrome and one cyan-highlighted stage.","The CANDIDATE visibly provides construction progress, current stage, result, and next-stage cells."],"different":["The CANDIDATE uses slightly narrower text-led cells while the REFERENCE uses larger icon-led controls."],"evidence":[{"imageRole":"REFERENCE","roi":"TIMELINE","box":[284,918,627,1000],"observation":"Centered four-control playback strip with clear active cyan selection."},{"imageRole":"CANDIDATE","roi":"TIMELINE","box":[285,928,620,999],"observation":"Independent four-stage event bar shows numeric progress, active stage, result, and next."}],"criticalFailure":false}]}