{"pairId":"PAIR-KIT-CITY","judgeSlot":"SOL-ULTRA","order":"REFERENCE_FIRST","replicate":1,"criteria":[{"criterion":"camera","label":"CLOSE","confidence":"HIGH","similar":["Matching high-oblique isometric projection and diagonal ground axes.","Comparable three-quarter roof visibility and orthographic feel."],"different":["Candidate often frames individual structures more tightly.","Reference more often preserves broad neighborhood context."],"evidence":[{"imageRole":"REFERENCE","roi":"MAP","box":[28,118,241,341],"observation":"Roofs, roads, and blocks share a consistent high-oblique isometric view."},{"imageRole":"CANDIDATE","roi":"MAP","box":[28,127,241,330],"observation":"Buildings and terrain follow nearly the same opposing diagonal axes and pitch."},{"imageRole":"REFERENCE","roi":"MAP","box":[514,731,727,953],"observation":"Industrial landmark is framed with extensive surrounding city context." 	} 	] 	,"criticalFailure":false} 	,{"criterion":"scale","label":"CLOSE","confidence":"MEDIUM","similar":["Transmission structures remain roughly one to two building heights.","Major facilities read several times larger than nearby housing."],"different":["Candidate tall block landmarks are bulkier relative to adjacent low buildings.","Reference surrounds facilities with smaller, more numerous residential silhouettes."],"evidence":[{"imageRole":"REFERENCE","roi":"LANDMARK","box":[758,731,970,953],"observation":"Power pylons, factories, and housing retain a clear stepped size hierarchy."},{"imageRole":"CANDIDATE","roi":"LANDMARK","box":[514,433,727,638],"observation":"Pole and substation silhouettes occupy comparable proportions against nearby blocks."},{"imageRole":"REFERENCE","roi":"LANDMARK","box":[145,165,235,330],"observation":"Substation landmark is about two to three nearby house widths." 	} 	] 	,"criticalFailure":false} 	,{"criterion":"material","label":"CLOSE","confidence":"HIGH","similar":["Both use charcoal metal and concrete over brown soil with amber window light.","Cyan infrastructure accents contrast against the same subdued industrial palette."],"different":["Candidate surfaces are darker and flatter, with weaker micro-detail separation.","Reference carries richer warm midtones and more cohesive amber illumination."],"evidence":[{"imageRole":"REFERENCE","roi":"KIT","box":[758,118,970,341],"observation":"Blackened factory metal, concrete roads, and warm point lighting are sharply separated."},{"imageRole":"CANDIDATE","roi":"KIT","box":[758,433,970,638],"observation":"The same dark industrial materials and amber windows remain immediately recognizable."},{"imageRole":"REFERENCE","roi":"MAP","box":[28,424,241,646],"observation":"Warm soil, roofs, roads, and lit windows retain distinct detailed textures." 	} 	] 	,"criticalFailure":false} 	]}