{"pairId":"PAIR-SITING","judgeSlot":"SOL-ULTRA","order":"REFERENCE_FIRST","replicate":1,"criteria":[{"criterion":"camera","label":"PARITY","confidence":"HIGH","similar":["Matching isometric projection, yaw, pitch, and terrain axes.","Plants, city, river, and industrial district occupy the same world-frame positions."],"different":["The CANDIDATE bottom navigation masks a narrow lower-center portion of the otherwise matching frame."],"evidence":[{"imageRole":"REFERENCE","roi":"MAP","box":[50,61,781,998],"observation":"Full map shows the shared diagonal mountain-to-city framing and elevated isometric viewpoint."},{"imageRole":"CANDIDATE","roi":"MAP","box":[50,61,781,918],"observation":"Visible world uses the same projection, viewpoint, and landmark placement."},{"imageRole":"REFERENCE","roi":"MAP","box":[260,918,692,998],"observation":"Lower-center world remains exposed to the frame edge."               			}],"criticalFailure":false},{"criterion":"density","label":"PARITY","confidence":"HIGH","similar":["City, central industry, roads, and transmission corridors have matching occupied footprints.","Sparse mountain and valley regions balance the dense lower and right-side districts identically."],"different":["Darker CANDIDATE contrast makes small terrain and building marks read slightly busier without changing mass distribution."],"evidence":[{"imageRole":"REFERENCE","roi":"LANDMARK","box":[270,620,780,958],"observation":"Central industrial mass, lower infrastructure, and right city edge establish the same density pattern."},{"imageRole":"CANDIDATE","roi":"LANDMARK","box":[270,620,780,918],"observation":"Industrial blocks, roads, and city mass align with the reference footprint."},{"imageRole":"REFERENCE","roi":"MAP","box":[620,180,781,610],"observation":"The right-side city has the same compact building concentration."               		}],"criticalFailure":false},{"criterion":"river","label":"CLOSE","confidence":"HIGH","similar":["The channel follows the same winding mountain-to-industrial curvature.","Bank depth and the lower bridge attachment occur at matching locations."],"different":["CANDIDATE water and banks are darker and higher-contrast, with less pale reflective lift."],"evidence":[{"imageRole":"REFERENCE","roi":"RIVER","box":[255,80,455,782],"observation":"Pale winding channel descends through the valley and meets the bridge near the industrial district."},{"imageRole":"CANDIDATE","roi":"RIVER","box":[255,80,455,782],"observation":"Channel geometry and bridge junction match, while water and banks render darker."}],"criticalFailure":false},{"criterion":"scale","label":"PARITY","confidence":"HIGH","similar":["Plants A and B retain matching sizes relative to mountains, city blocks, and distance arcs.","Transmission towers and the lower substation preserve the same relative silhouette scale."],"different":["CANDIDATE's sharper outlines make some tower silhouettes read marginally thinner, not differently sized."],"evidence":[{"imageRole":"REFERENCE","roi":"LANDMARK","box":[95,130,590,430],"observation":"Both nuclear plant silhouettes have the same relative scale and placement."},{"imageRole":"CANDIDATE","roi":"LANDMARK","box":[95,130,590,430],"observation":"Plant footprints and dome/cooling-tower proportions match the reference."},{"imageRole":"REFERENCE","roi":"GRID","box":[250,610,750,960],"observation":"Towers and substation share the same scale relationship with the industrial buildings."               		}],"criticalFailure":false},{"criterion":"material","label":"CLOSE","confidence":"HIGH","similar":["Both use blackened riveted metal, muted concrete, brown soil, and amber practical lighting.","Terrain, structures, and chrome overlays share the same weathered industrial cohesion."],"different":["CANDIDATE has deeper blacks, sharper texture, and stronger amber saturation; REFERENCE is softer and slightly grayer."],"evidence":[{"imageRole":"REFERENCE","roi":"MAP","box":[50,61,781,918],"observation":"Soft gray-brown terrain and concrete sit beneath restrained amber lighting."},{"imageRole":"CANDIDATE","roi":"MAP","box":[50,61,781,918],"observation":"The same material family is rendered with darker midtones and crisper texture."},{"imageRole":"REFERENCE","roi":"HUD","box":[782,61,992,918],"observation":"Inspector uses layered, worn black metal with amber and cyan edging."               		}],"criticalFailure":false},{"criterion":"grid","label":"CLOSE","confidence":"HIGH","similar":["Amber routes connect both plant sites with the same tower spacing and attachment geometry.","Cyan energized lines follow the same lower route through towers and the substation."],"different":["CANDIDATE conductors and voltage plaques are slightly crisper and brighter, with different glyph formatting."],"evidence":[{"imageRole":"REFERENCE","roi":"GRID","box":[90,145,690,690],"observation":"Amber plant corridors, pylons, and route labels follow the shared geometry."},{"imageRole":"CANDIDATE","roi":"GRID","box":[90,145,690,690],"observation":"Amber corridors attach to the same plants and towers with matching readability."},{"imageRole":"REFERENCE","roi":"GRID","box":[50,600,780,960],"observation":"Cyan lower network traces the same energized route and substation attachment."               		}],"criticalFailure":false},{"criterion":"hud","label":"RELATED","confidence":"HIGH","similar":["Top status bar, left technology rail, and right inspector share the same industrial chrome system.","Inspector cards preserve matching amber/cyan hierarchy, totals, dividers, and stacked action buttons."],"different":["CANDIDATE adds a large four-tab bottom navigation strip absent from REFERENCE, materially increasing overlay footprint.","English and Korean glyph systems produce visibly different label widths and text texture."],"evidence":[{"imageRole":"REFERENCE","roi":"HUD","box":[0,0,782,690],"observation":"Top status chrome and left icon rail establish the shared industrial HUD language."},{"imageRole":"CANDIDATE","roi":"HUD","box":[0,0,782,690],"observation":"Matching chrome, icon order, and status hierarchy appear with Korean glyphs."},{"imageRole":"REFERENCE","roi":"HUD","box":[782,61,992,990],"observation":"Right inspector has two framed comparison cards and two stacked action controls."                    }],"criticalFailure":false}]}