{"pairId":"PAIR-HEAT","judgeSlot":"SOL-ULTRA","order":"REFERENCE_FIRST","replicate":1,"criteria":[{"criterion":"camera","label":"CLOSE","confidence":"HIGH","similar":["Both use an oblique isometric projection with vertical structures and diagonal ground axes.","Both frame industrial generation opposite a larger urban load area."],"different":["REFERENCE is framed slightly tighter and lower around the central grid chain.","CANDIDATE is slightly wider and more top-down, exposing more empty central terrain."],"evidence":[{"imageRole":"REFERENCE","roi":"MAP","box":[70,88,835,930],"observation":"Tight isometric view centers the pylon chain between left industry and right city."},{"imageRole":"CANDIDATE","roi":"MAP","box":[88,82,815,925],"observation":"Comparable isometric yaw and pitch, but broader terrain and smaller distributed landmarks are visible."}],"criticalFailure":false},{"criterion":"density","label":"RELATED","confidence":"HIGH","similar":["Both maps contain industrial clusters, utility corridors, and dense residential districts.","Both place the strongest urban mass toward the right or lower-right."],"different":["REFERENCE maintains nearly continuous roads, buildings, and terrain detail across the map.","CANDIDATE has broad sparse central fields and more isolated building clusters."],"evidence":[{"imageRole":"REFERENCE","roi":"MAP","box":[55,95,995,930],"observation":"Industrial, road, pylon, and housing detail occupies almost the entire visible world."},{"imageRole":"CANDIDATE","roi":"MAP","box":[90,82,815,925],"observation":"Dense edge districts surround a substantially emptier central map area."}],"criticalFailure":false},{"criterion":"river","label":"RELATED","confidence":"HIGH","similar":["Both use a winding dark channel to separate industrial and urban areas.","Both channels are embedded into the terrain rather than shown as bright blue water."],"different":["REFERENCE shows a broad, deep rocky ravine with pronounced banks and a diagonal course.","CANDIDATE shows a narrower, flatter outlined channel with weaker bank depth and unclear crossings."],"evidence":[{"imageRole":"REFERENCE","roi":"RIVER","box":[0,360,555,1000],"observation":"A wide shadowed ravine curves diagonally toward the lower-left with layered rocky banks."},{"imageRole":"CANDIDATE","roi":"RIVER","box":[75,80,410,750],"observation":"A thin dark channel bends down the center-left with shallow, low-contrast banks."}],"criticalFailure":false},{"criterion":"scale","label":"CLOSE","confidence":"MEDIUM","similar":["Plants remain the largest industrial silhouettes, pylons occupy the middle tier, and homes remain smallest.","Substations are visually distinct from both towers and major facilities."],"different":["CANDIDATE civic and commercial blocks are chunkier relative to nearby pylons and substations.","REFERENCE has more varied plant and facility silhouette sizes."],"evidence":[{"imageRole":"REFERENCE","roi":"LANDMARK","box":[45,110,315,845],"observation":"Large multi-part plants, medium pylons and substations, and small surrounding structures form a clear hierarchy."},{"imageRole":"CANDIDATE","roi":"LANDMARK","box":[70,125,265,805],"observation":"The same broad hierarchy is present, though major blocks and utility sprites are more uniformly chunky."}],"criticalFailure":false},{"criterion":"material","label":"CLOSE","confidence":"HIGH","similar":["Both use blackened industrial metal, brown soil, amber illumination, and cool cyan energy accents.","Both combine dark chrome HUD frames with a heat-washed world palette."],"different":["REFERENCE has richer rocky relief, concrete variation, highlights, and midtone separation.","CANDIDATE is darker and flatter, with repeated ground tiles and less surface cohesion."],"evidence":[{"imageRole":"REFERENCE","roi":"MAP","box":[75,90,825,930],"observation":"Layered rock, roads, roofs, metal, and localized amber lights create a strongly dimensional surface."},{"imageRole":"CANDIDATE","roi":"MAP","box":[90,82,815,925],"observation":"Matching sepia-black materials are visible, but terrain and structures have flatter tonal modeling."}],"criticalFailure":false},{"criterion":"grid","label":"RELATED","confidence":"HIGH","similar":["Both use cyan conductors to connect pylons, substations, plants, and load areas.","Both introduce contrasting amber, yellow, or red routes for non-normal grid states."],"different":["REFERENCE routes form a compact, bright chain with clear tower attachment and one readable stressed segment.","CANDIDATE routes use many sweeping double lines and crossings, weakening endpoint and energized-path readability."],"evidence":[{"imageRole":"REFERENCE","roi":"GRID","box":[120,175,780,850],"observation":"Bright cyan-white links visibly terminate at successive towers and substations; an amber segment isolates stress."},{"imageRole":"CANDIDATE","roi":"GRID","box":[45,75,800,850],"observation":"Cyan arcs, a yellow dashed route, and a red dashed fault are distinct, but several routes overlap or sweep past nodes."}],"criticalFailure":false},{"criterion":"hud","label":"CLOSE","confidence":"HIGH","similar":["Both use segmented industrial chrome across the top, a vertical build kit on the left, and an inspector on the right.","Cyan, amber, and red status colors are integrated consistently with the map."],"different":["REFERENCE presents fewer, larger status readouts with stronger immediate hierarchy.","CANDIDATE panels are more text-dense, and several inspector and kit labels are visibly smaller."],"evidence":[{"imageRole":"REFERENCE","roi":"HUD","box":[0,0,1000,86],"observation":"Large riveted top modules separate heat, supply, reserve, day, and pause status."},{"imageRole":"REFERENCE","roi":"HUD","box":[832,98,992,555],"observation":"Right inspector uses a large asset image, capacity readout, unavailable state, and condition bar."},{"imageRole":"CANDIDATE","roi":"HUD","box":[0,0,1000,82],"observation":"A closely matching riveted top bar separates settings, money, supply, heat alert, speed, and purchase."}],"criticalFailure":false},{"criterion":"state","label":"PARITY","confidence":"HIGH","similar":["Both explicitly show a +8°C heat event with a large pale sun and an amber-brown world wash.","Both pair the heat state with stressed or unavailable grid feedback."],"different":["REFERENCE emphasizes low reserve and an unavailable tower, while CANDIDATE emphasizes safety-boundary progress and a protected fault."],"evidence":[{"imageRole":"REFERENCE","roi":"STATE-CONTEXT","box":[88,0,575,86],"observation":"The top HUD visibly combines HEAT +8°C, high demand, and 6% reserve."},{"imageRole":"REFERENCE","roi":"STATE-CONTEXT","box":[742,30,992,555],"observation":"Bright sun, warning context, and an unavailable 0 MW inspector reinforce the heat emergency."},{"imageRole":"CANDIDATE","roi":"STATE-CONTEXT","box":[410,0,720,85],"observation":"The top alert visibly states a +8°C heatwave and morning safety-boundary status."}],"criticalFailure":false},{"criterion":"timeline","label":"CLOSE","confidence":"HIGH","similar":["Both use a centered four-cell black-metal strip occupying roughly one-third of the screen width.","Both clearly highlight the current cell in cyan and retain readable neighboring states."],"different":["REFERENCE uses a taller playback strip with large transport icons and speed labels.","CANDIDATE uses a thinner event-stage bar with smaller labels, completion checks, a current diamond, and pending rings."],"evidence":[{"imageRole":"REFERENCE","roi":"TIMELINE","box":[283,916,627,1000],"observation":"Four large chrome playback cells are centered at the bottom, with the active x1 cell outlined cyan."},{"imageRole":"CANDIDATE","roi":"TIMELINE","box":[284,927,624,999],"observation":"An independent four-stage event bar shows completed, current, result, and next states with distinct progress glyphs."}],"criticalFailure":false}]}