{"pairId":"PAIR-NORMAL","judgeSlot":"SOL-ULTRA","order":"REFERENCE_FIRST","replicate":1,"criteria":[{"criterion":"camera","label":"CLOSE","confidence":"HIGH","similar":["Both use a steep isometric projection with matching diagonal ground axes.","Both frame a broad industrial-city network from a fixed elevated view."],"different":["The CANDIDATE is slightly more top-down and shows a wider world area.","The CANDIDATE exposes its tiled ground geometry more strongly."],"evidence":[{"imageRole":"REFERENCE","roi":"MAP","box":[96,88,829,916],"observation":"Elevated isometric framing shows roofs, short facades, and two dominant diagonal axes."},{"imageRole":"CANDIDATE","roi":"MAP","box":[94,82,819,928],"observation":"The same elevated diagonal projection is visible, with somewhat wider and more top-down framing."}],"criticalFailure":false},{"criterion":"density","label":"RELATED","confidence":"MEDIUM","similar":["Both concentrate industry on the left and dense housing on the right.","Roads, facilities, and small buildings occupy most of each visible map."],"different":["The CANDIDATE has larger open gridded parcels through the center.","REFERENCE mass is more continuously distributed, while CANDIDATE housing forms heavier edge clusters."],"evidence":[{"imageRole":"REFERENCE","roi":"MAP","box":[58,102,946,907],"observation":"Industry, roads, rubble, and housing form a nearly continuous occupied field."},{"imageRole":"CANDIDATE","roi":"MAP","box":[92,87,954,925],"observation":"Comparable industrial and residential density surrounds visibly broader open central parcels."}],"criticalFailure":false},{"criterion":"river","label":"RELATED","confidence":"MEDIUM","similar":["Both rivers are dark blue, recessed, rocky-banked channels with an S-like bend.","Each channel is integrated with a bridge or road crossing."],"different":["The CANDIDATE channel is a more prominent central-left S curve.","REFERENCE shows a longer diagonal channel context and different crossing placement."],"evidence":[{"imageRole":"REFERENCE","roi":"RIVER","box":[0,245,617,995],"observation":"A narrow dark channel winds diagonally through deep textured banks and transport crossings."},{"imageRole":"CANDIDATE","roi":"RIVER","box":[83,263,512,724],"observation":"A broad central-left S-shaped channel has rocky banks and a conspicuous bridge attachment."}],"criticalFailure":false},{"criterion":"scale","label":"CLOSE","confidence":"HIGH","similar":["Plants and substations remain several times larger than nearby houses.","Transmission towers have comparable height and footprint relative to roads and buildings."],"different":["CANDIDATE map silhouettes are slightly smaller because of the wider framing.","Its large residential blocks and hospital create somewhat stronger landmark contrast."],"evidence":[{"imageRole":"REFERENCE","roi":"LANDMARK","box":[55,118,814,779],"observation":"Factories, substations, towers, and small houses follow a consistent stepped size hierarchy."},{"imageRole":"CANDIDATE","roi":"LANDMARK","box":[119,102,829,864],"observation":"The same relative hierarchy is present, though the wider view reduces most map silhouettes."}],"criticalFailure":false},{"criterion":"material","label":"CLOSE","confidence":"HIGH","similar":["Both use blackened metal, charcoal soil, worn concrete, and sparse amber illumination.","World and interface details share a cohesive distressed industrial finish."],"different":["REFERENCE has slightly stronger blue glow and brighter metallic edge highlights.","CANDIDATE terrain is flatter and more uniformly gray in its midtones."],"evidence":[{"imageRole":"REFERENCE","roi":"MAP","box":[91,91,824,906],"observation":"Dense rubble, oxidized structures, warm windows, and luminous conductors create a richly contrasted dark surface."},{"imageRole":"CANDIDATE","roi":"MAP","box":[94,84,818,924],"observation":"Matching distressed masonry and metal textures appear with quieter highlights and flatter midtones."}],"criticalFailure":false},{"criterion":"grid","label":"CLOSE","confidence":"HIGH","similar":["Both clearly separate cyan energized conductors from amber dashed planned routes.","Parallel conductors visibly follow tower chains between plants and populated areas."],"different":["REFERENCE cyan routes have a stronger bloom and smoother continuous sweep.","CANDIDATE routes use sharper bends, and some tower attachments read less directly."],"evidence":[{"imageRole":"REFERENCE","roi":"GRID","box":[121,91,838,617],"observation":"Bright parallel cyan lines connect blue-lit towers and substations with strong route continuity."},{"imageRole":"REFERENCE","roi":"GRID","box":[231,381,698,850],"observation":"Amber towers and dashed conductors form a distinct planned lower circuit."},{"imageRole":"CANDIDATE","roi":"GRID","box":[139,74,704,574],"observation":"Triple cyan conductors and pale towers form a readable energized route across the upper map."}],"criticalFailure":false},{"criterion":"hud","label":"CLOSE","confidence":"MEDIUM","similar":["Both use heavy riveted chrome across a segmented top bar, left kit, and right inspector.","Their overlay proportions and cyan-versus-amber hierarchy are closely matched."],"different":["CANDIDATE relies on smaller text and denser status labels.","Its inspector contains a larger underused dark section than the compact REFERENCE inspector."],"evidence":[{"imageRole":"REFERENCE","roi":"HUD","box":[0,0,1000,86],"observation":"A compact riveted top bar presents currency, power, day, and pause status in large type."},{"imageRole":"CANDIDATE","roi":"HUD","box":[0,0,1000,81],"observation":"A nearly identical segmented chrome bar uses denser, smaller Korean status text."},{"imageRole":"REFERENCE","roi":"KIT","box":[0,285,94,841],"observation":"Four large icon cards form a strongly integrated vertical construction kit."}],"criticalFailure":false},{"criterion":"timeline","label":"PARITY","confidence":"HIGH","similar":["Both use a centered four-cell bottom strip with the same footprint and industrial chrome.","Both highlight the active cell in cyan while keeping inactive cells dark."],"different":["REFERENCE cells show playback controls and speed values.","CANDIDATE cells show completion, current progress, result, and next-stage states."],"evidence":[{"imageRole":"REFERENCE","roi":"TIMELINE","box":[285,918,628,1000],"observation":"A centered four-part playback strip has equal dark cells and one cyan-selected state."},{"imageRole":"CANDIDATE","roi":"TIMELINE","box":[286,929,622,1000],"observation":"A centered independent four-stage event bar shows completion, active progress, result, and next states with matching chrome."}],"criticalFailure":false}]}