{"pairId":"PAIR-SITING","judgeSlot":"SOL-ULTRA","order":"REFERENCE_FIRST","replicate":1,"criteria":[{"criterion":"camera","label":"RELATED","confidence":"HIGH","similar":["Both use an elevated oblique view with upright vertical structures and diagonal ground axes.","Both frame a complete industrial district rather than a close-up landmark."],"different":["REFERENCE has a shallower, landscape-led valley view; CANDIDATE is more top-down and tile-plane dominant.","REFERENCE frames broad terrain depth, while CANDIDATE is tighter around buildings and route infrastructure."],"evidence":[{"imageRole":"REFERENCE","roi":"MAP","box":[49,64,781,996],"observation":"Broad oblique valley framing with receding mountains and city at the right edge."},{"imageRole":"CANDIDATE","roi":"MAP","box":[93,82,821,925],"observation":"Higher, flatter isometric framing centered on the developed tile plane."},{"imageRole":"REFERENCE","roi":"MAP","box":[55,82,430,680],"observation":"Large mountain and open-valley foreground establishes shallow scenic depth." 		}],"criticalFailure":false},{"criterion":"density","label":"RELATED","confidence":"HIGH","similar":["Both concentrate dense town blocks beside heavy industrial facilities.","Both retain rocky or undeveloped margins around the occupied district."],"different":["REFERENCE preserves a broad open central valley; CANDIDATE fills much more of the center and upper map with repeated buildings.","CANDIDATE distributes several large plant compounds across the map, while REFERENCE concentrates its main industrial mass near the bottom."],"evidence":[{"imageRole":"REFERENCE","roi":"MAP","box":[55,100,780,950],"observation":"Open valley separates the right-side city from the concentrated lower industrial district."},{"imageRole":"CANDIDATE","roi":"MAP","box":[100,85,815,910],"observation":"Town blocks and industrial compounds occupy most of the central playable area."},{"imageRole":"REFERENCE","roi":"LANDMARK","box":[235,615,760,978],"observation":"Primary dense industrial mass is concentrated along the lower corridor." 	}],"criticalFailure":false},{"criterion":"river","label":"RELATED","confidence":"HIGH","similar":["Both show a dark blue-gray sinuous channel cut through industrial terrain.","In both, infrastructure bridges the channel and facilities sit close to its banks."],"different":["REFERENCE uses a narrower, mostly vertical valley channel; CANDIDATE uses a wider diagonal channel with different bends.","CANDIDATE has two prominent orange-deck bridges and flatter water, versus one dominant bridge and softer reflective water in REFERENCE."],"evidence":[{"imageRole":"REFERENCE","roi":"RIVER","box":[240,160,421,810],"observation":"Narrow channel descends through a deep shaded valley with muted reflections."},{"imageRole":"CANDIDATE","roi":"RIVER","box":[130,350,555,840],"observation":"Wider dark channel runs diagonally across the tiled district."},{"imageRole":"REFERENCE","roi":"RIVER","box":[270,588,407,705],"observation":"One dominant bridge attaches the lower industrial banks." 	}],"criticalFailure":false},{"criterion":"scale","label":"RELATED","confidence":"HIGH","similar":["Major plants dominate nearby houses, while pylons remain intermediate-scale landmarks.","Bridges and utility structures are readable individually in both maps."],"different":["CANDIDATE plants, bridges, and pylons occupy substantially more screen area relative to town blocks.","REFERENCE has compact nuclear-site silhouettes and a prominent lower substation; CANDIDATE emphasizes large thermal plants without an equally dominant substation form."],"evidence":[{"imageRole":"REFERENCE","roi":"LANDMARK","box":[95,125,590,435],"observation":"Two compact nuclear-site silhouettes remain small against the landscape."},{"imageRole":"REFERENCE","roi":"LANDMARK","box":[230,625,760,975],"observation":"Large industrial complex and cyan substation establish a layered landmark scale."},{"imageRole":"CANDIDATE","roi":"LANDMARK","box":[245,205,465,680],"observation":"Thermal plant compounds and bridges are large relative to surrounding blocks." 	}],"criticalFailure":false},{"criterion":"material","label":"CLOSE","confidence":"HIGH","similar":["Both combine blackened metal, dark concrete and soil with sparse amber illumination.","Both maintain dense industrial surface detail across structures, terrain, and chrome framing."],"different":["REFERENCE has warmer sepia midtones and atmospheric painterly blending.","CANDIDATE is nearer-black, sharper, and more visibly repetitive at the tile and sprite level."],"evidence":[{"imageRole":"REFERENCE","roi":"MAP","box":[50,75,780,980],"observation":"Warm charcoal terrain, smoky midtones, and amber highlights form a cohesive industrial palette."},{"imageRole":"CANDIDATE","roi":"MAP","box":[95,85,820,920],"observation":"Matching charcoal-and-amber palette rendered with crisper, darker tiled textures."},{"imageRole":"REFERENCE","roi":"LANDMARK","box":[235,620,760,970],"observation":"Industrial structures blend concrete, soot, metal, and warm window light." 	}],"criticalFailure":false},{"criterion":"grid","label":"CLOSE","confidence":"HIGH","similar":["Both clearly separate energized cyan conductors from planned amber routes.","Both use multi-strand conductors attached to repeated transmission towers with readable sag."],"different":["REFERENCE routes cyan around the lower perimeter and amber from two siting options; CANDIDATE forms a large cyan loop with shorter dashed amber branches.","CANDIDATE cyan strokes are brighter and more ribbon-like, while REFERENCE conductors integrate more softly with the terrain."],"evidence":[{"imageRole":"REFERENCE","roi":"GRID","box":[57,606,757,957],"observation":"Cyan energized conductors track a lower tower corridor and converge near the substation."},{"imageRole":"CANDIDATE","roi":"GRID","box":[271,194,664,620],"observation":"Bright cyan multi-line loop attaches to pylons around the central district."},{"imageRole":"REFERENCE","roi":"GRID","box":[132,198,682,650],"observation":"Amber paired conductors visibly connect both candidate sites toward the grid." 	}],"criticalFailure":false},{"criterion":"hud","label":"CLOSE","confidence":"MEDIUM","similar":["Both use riveted industrial chrome with a segmented top bar, left tool kit, and right inspector.","Both organize inspector choices with amber and cyan accents over a dark map-integrated frame."],"different":["REFERENCE gives larger numeric cost hierarchy and fills the inspector vertically; CANDIDATE uses smaller text and leaves a large empty lower inspector area.","CANDIDATE top chrome is more heavily segmented and ornamented than the slimmer REFERENCE status strip."],"evidence":[{"imageRole":"REFERENCE","roi":"HUD","box":[0,0,1000,56],"observation":"Slim riveted top status strip uses large centered readouts."},{"imageRole":"CANDIDATE","roi":"HUD","box":[0,0,1000,81],"observation":"Taller segmented top bar uses matching dark metal and amber/cyan accents."},{"imageRole":"REFERENCE","roi":"HUD","box":[785,60,997,997],"observation":"Right inspector is filled by two large comparison cards and prominent action buttons." 	}],"criticalFailure":false}]}