{"pairId":"PAIR-KIT-GROUND","judgeSlot":"SOL-ULTRA","order":"REFERENCE_FIRST","replicate":1,"criteria":[{"criterion":"camera","label":"RELATED","confidence":"HIGH","similar":["Both use an oblique isometric projection with diagonal ground axes.","Industrial structures and transmission towers are viewed from a consistent elevated yaw."],"different":["CANDIDATE framing is consistently wider and more top-down, with smaller facilities and longer visible road runs.","REFERENCE crops feel tighter and lower, emphasizing large foreground textures and silhouettes."],"evidence":[{"imageRole":"REFERENCE","roi":"MAP","box":[28,127,241,331],"observation":"Tight oblique framing gives the plant, pole, and diagonal road large screen presence."},{"imageRole":"CANDIDATE","roi":"MAP","box":[28,127,241,331],"observation":"The matching crop presents a broader, flatter map area with much smaller equipment."},{"imageRole":"REFERENCE","roi":"MAP","box":[758,127,970,331],"observation":"Large factory masses and close ground framing dominate the crop."}],"criticalFailure":false},{"criterion":"material","label":"RELATED","confidence":"HIGH","similar":["Both use charcoal industrial structures, dark ground, sparse amber lights, and cyan accents.","Warm-state crops retain a brown soil-and-metal palette in both boards."],"different":["REFERENCE has stronger embossed microtexture, warmer midtones, and cohesive edge highlights.","CANDIDATE surfaces are darker and flatter, with repetitive parcel lines and a more uniform brown wash."],"evidence":[{"imageRole":"REFERENCE","roi":"KIT","box":[758,127,970,331],"observation":"Roofs, concrete, roads, and soil carry dense relief detail with integrated amber highlights."},{"imageRole":"CANDIDATE","roi":"KIT","box":[758,127,970,331],"observation":"The factory shares the charcoal-and-amber palette but sits on flatter, lower-contrast terrain."},{"imageRole":"REFERENCE","roi":"KIT","box":[28,433,241,638],"observation":"Warm rocky soil has articulated stones, tonal variation, and bright metallic towers."}],"criticalFailure":false},{"criterion":"state","label":"RELATED","confidence":"HIGH","similar":["Both shift from a dark neutral upper row to a warm brown middle row while retaining the industrial kit.","Transmission towers, factories, and route accents remain recognizable across the visible state changes."],"different":["REFERENCE ends in a diffuse olive-amber territory haze, while CANDIDATE returns to crisp charcoal terrain with blue water and bright cyan routing.","CANDIDATE's warm state reads as a broad uniform tint; REFERENCE integrates the warmth into terrain and local lighting."],"evidence":[{"imageRole":"REFERENCE","roi":"STATE-CONTEXT","box":[28,433,241,638],"observation":"Warm ground and lighting preserve the same tower-and-road world language."},{"imageRole":"CANDIDATE","roi":"STATE-CONTEXT","box":[28,433,241,638],"observation":"The same industrial assets persist under a broad brown environmental tint."},{"imageRole":"REFERENCE","roi":"STATE-CONTEXT","box":[271,740,484,943],"observation":"The lower-row world is softened by an olive-amber haze and translucent route coverage."}],"criticalFailure":false}]}