{"pairId":"PAIR-NORMAL","judgeSlot":"SOL-ULTRA","order":"REFERENCE_FIRST","replicate":1,"criteria":[{"criterion":"camera","label":"CLOSE","confidence":"HIGH","similar":["Both use an oblique isometric view with matching diagonal ground axes.","Buildings and lattice towers share a similar pitch and upright presentation."],"different":["REFERENCE frames separated operational zones with more open terrain.","CANDIDATE uses a broader city-filled composition centered on a vertical river."],"evidence":[{"imageRole":"REFERENCE","roi":"MAP","box":[92,86,833,912],"observation":"Oblique map view shows diagonal roads, separated districts, and broad open ground."},{"imageRole":"CANDIDATE","roi":"MAP","box":[70,73,836,889],"observation":"Matching oblique projection covers a denser, river-centered city frame."}],"criticalFailure":false},{"criterion":"density","label":"RELATED","confidence":"HIGH","similar":["Both maps contain industrial clusters, residential blocks, and extensive road texture.","Occupied regions use tightly packed small structures."],"different":["REFERENCE retains large rocky and smoky gaps between three main clusters.","CANDIDATE fills nearly all non-water terrain with continuous urban fabric."],"evidence":[{"imageRole":"REFERENCE","roi":"MAP","box":[85,88,830,912],"observation":"Large unoccupied central and upper-right areas separate industrial and residential masses."},{"imageRole":"CANDIDATE","roi":"MAP","box":[72,75,835,888],"observation":"Dense buildings and roads extend almost continuously across both riverbanks."}],"criticalFailure":false},{"criterion":"river","label":"RELATED","confidence":"HIGH","similar":["Both show dark blue water with irregular rocky banks.","Power routes visibly approach or cross the water corridor."],"different":["REFERENCE has a narrow diagonal creek with subdued reflections.","CANDIDATE has a broad vertical channel with deep banks, islands, and stronger reflected light."],"evidence":[{"imageRole":"REFERENCE","roi":"RIVER","box":[0,257,566,999],"observation":"A narrow meandering channel runs diagonally toward the lower-left edge."},{"imageRole":"CANDIDATE","roi":"RIVER","box":[405,72,646,890],"observation":"A wide continuous river divides the map vertically and supports multiple crossings."}],"criticalFailure":false},{"criterion":"scale","label":"CLOSE","confidence":"HIGH","similar":["Power plants remain the largest industrial silhouettes in both views.","Transmission towers and substations have closely matched relative sizes."],"different":["CANDIDATE surrounds the facilities with smaller and more numerous city buildings.","The CANDIDATE upper-left plant occupies slightly more visual mass relative to nearby towers."],"evidence":[{"imageRole":"REFERENCE","roi":"LANDMARK","box":[29,124,156,350],"observation":"Large plant, nearby towers, and small utility structures establish the reference scale ladder."},{"imageRole":"REFERENCE","roi":"GRID","box":[405,177,518,334],"observation":"Central substation and adjacent lattice towers show consistent facility proportions."},{"imageRole":"CANDIDATE","roi":"LANDMARK","box":[69,91,223,390],"observation":"Upper-left plant is dominant while nearby towers retain a comparable relative scale."}],"criticalFailure":false},{"criterion":"material","label":"CLOSE","confidence":"HIGH","similar":["Both use blackened steel, charcoal concrete and soil, and restrained blue-gray midtones.","Amber window lights and cyan electrical glow share the same weathered industrial palette."],"different":["REFERENCE has softer blue haze and larger muted terrain patches.","CANDIDATE is sharper and more granular, with denser copper-amber highlights."],"evidence":[{"imageRole":"REFERENCE","roi":"MAP","box":[87,503,501,922],"observation":"Soot-dark factories, roads, rock, and sparse amber lights form a subdued material field."},{"imageRole":"CANDIDATE","roi":"MAP","box":[70,529,438,884],"observation":"The same dark industrial materials appear with finer, more numerous illuminated details."}],"criticalFailure":false},{"criterion":"grid","label":"CLOSE","confidence":"HIGH","similar":["Both distinguish energized cyan conductors from dashed amber planned conductors.","Lattice towers act as readable route nodes with bright line attachments."],"different":["REFERENCE cyan routes are paired with multiple large translucent service-area overlays.","CANDIDATE emphasizes longer river-spanning routes and shows only a small local selection ring."],"evidence":[{"imageRole":"REFERENCE","roi":"GRID","box":[119,100,716,507],"observation":"Glowing cyan lines connect plants, towers, and substations across the upper map."},{"imageRole":"REFERENCE","roi":"GRID","box":[226,360,648,839],"observation":"Amber towers and dashed conductors clearly denote a planned lower route."},{"imageRole":"CANDIDATE","roi":"GRID","box":[184,180,721,831],"observation":"Cyan energized and amber planned networks remain distinct across both riverbanks."}],"criticalFailure":false},{"criterion":"hud","label":"RELATED","confidence":"HIGH","similar":["Both use riveted black industrial chrome around the top, left kit, and right inspector.","Cyan and amber accents consistently separate power and status information."],"different":["CANDIDATE has denser labeling, a taller inspector, and a full-width lower overlay.","REFERENCE uses a compact inspector, mostly icon-led kit, and a small centered playback panel."],"evidence":[{"imageRole":"REFERENCE","roi":"HUD","box":[0,0,1000,87],"observation":"Segmented chrome top bar presents budget, power, day, and pause state."},{"imageRole":"REFERENCE","roi":"HUD","box":[834,98,998,472],"observation":"Compact right inspector prioritizes one facility image, capacity bar, and two actions."},{"imageRole":"CANDIDATE","roi":"HUD","box":[833,76,1000,604],"observation":"Taller inspector adds multiple labeled status rows beneath the facility summary."}],"criticalFailure":false},{"criterion":"timeline","label":"WEAK","confidence":"HIGH","similar":["Both place dark chrome process controls along the bottom edge.","Both reuse cyan selection and amber status accents."],"different":["REFERENCE shows only a compact playback-speed controller.","CANDIDATE shows an independent full-width event-stage bar with briefing, planning, progress, connection, result, and next-stage states."],"evidence":[{"imageRole":"REFERENCE","roi":"TIMELINE","box":[286,916,630,999],"observation":"Bottom panel contains reverse, play, and speed controls without event stages or results."},{"imageRole":"CANDIDATE","roi":"TIMELINE","box":[0,890,1000,999],"observation":"Full-width staged flow includes event count, current stage, construction progress, result, and next-stage control."}],"criticalFailure":true}]}